{
    "mdb_source_id": 2313,
    "data_type": "gtfs",
    "provider": "Jackson Transit Authority",
    "feed_contact_email": "support+test+jackson-tn-us@trilliumtransit.com",
    "location": {
        "country_code": "US",
        "subdivision_name": "Tennessee",
        "municipality": "Jackson",
        "bounding_box": {
            "minimum_latitude": 35.552018510209614,
            "maximum_latitude": 35.696360966631765,
            "minimum_longitude": -88.91979960877734,
            "maximum_longitude": -88.7718070791174,
            "extracted_on": "2024-11-28T18:37:41+00:00"
        }
    },
    "urls": {
        "direct_download": "https://data.trilliumtransit.com/gtfs/jackson-tn-us/jackson-tn-us.zip",
        "authentication_type": 0,
        "latest": "https://storage.googleapis.com/storage/v1/b/mdb-latest/o/us-tennessee-jackson-transit-authority-gtfs-2313.zip?alt=media"
    },
    "redirect": []
}
