{
    "mdb_source_id": 2370,
    "data_type": "gtfs",
    "provider": "Trasporto Passeggeri Emilia-Romagna",
    "name": "Marconi Express",
    "status": "deprecated",
    "location": {
        "country_code": "IT",
        "subdivision_name": "Emilia-Romagna",
        "municipality": "Bologna",
        "bounding_box": {
            "minimum_latitude": null,
            "maximum_latitude": null,
            "minimum_longitude": null,
            "maximum_longitude": null,
            "extracted_on": "2024-02-24T16:25:40+00:00"
        }
    },
    "urls": {
        "direct_download": "https://solweb.tper.it/web/tools/open-data/open-data-download.aspx?source=solweb.tper.it&filename=gtfsmex&version=20241223&format=zip",
        "authentication_type": 0,
        "latest": "https://storage.googleapis.com/storage/v1/b/mdb-latest/o/it-bologna-tper-marconi-gtfs-2370.zip?alt=media",
        "license": "https://solweb.tper.it/web/tools/open-data/open-data.aspx"
    },
    "redirect": [
        {
            "id": "3041",
            "comment": " "
        }
    ],
    "is_producer_url_unstable": "True"
}
