{
    "mdb_source_id": 157,
    "data_type": "gtfs",
    "provider": "Navajo Transit System",
    "features": [
        "fares-v1"
    ],
    "status": "deprecated",
    "location": {
        "country_code": "US",
        "subdivision_name": "New Mexico",
        "bounding_box": {
            "minimum_latitude": 35.19678643,
            "maximum_latitude": 37.63285827,
            "minimum_longitude": -111.23706119,
            "maximum_longitude": -108.13576118,
            "extracted_on": "2022-03-14T21:15:00+00:00"
        }
    },
    "urls": {
        "direct_download": "http://mjcaction.com/MJC_GTFS_Public/navajo_google_transit.zip",
        "authentication_type": 0,
        "latest": "https://storage.googleapis.com/storage/v1/b/mdb-latest/o/us-new-mexico-navajo-transit-system-gtfs-157.zip?alt=media"
    },
    "redirect": [
        {
            "id": "2346",
            "comment": " "
        }
    ]
}