{
    "mdb_source_id": 3560,
    "data_type": "gtfs",
    "provider": "SETA S.p.A. - Piacenza",
    "is_official": "False",
    "name": "BusOne",
    "location": {
        "country_code": "IT",
        "subdivision_name": "Emilia-Romagna",
        "municipality": "Piacenza",
        "bounding_box": {
            "minimum_latitude": 44.52584,
            "maximum_latitude": 45.14256,
            "minimum_longitude": 9.305587,
            "maximum_longitude": 10.065493,
            "extracted_on": "2026-10-07T19:15:59+00:00"
        }
    },
    "urls": {
        "direct_download": "https://proxy.busone.app/seta-pc/gtfs.zip",
        "authentication_type": 0,
        "latest": "https://storage.googleapis.com/storage/v1/b/mdb-latest/o/it-emilia-romagna-seta-spa-piacenza-gtfs-3560.zip?alt=media",
        "license": "https://proxy.busone.app/seta-pc/readme"
    },
    "redirect": []
}
