{
    "mdb_source_id": 1053,
    "data_type": "gtfs",
    "provider": "Loudoun County Transit",
    "location": {
        "country_code": "US",
        "subdivision_name": "Virginia",
        "bounding_box": {
            "minimum_latitude": 38.853478,
            "maximum_latitude": 39.143538,
            "minimum_longitude": -77.719972,
            "maximum_longitude": -77.00432,
            "extracted_on": "2022-04-25T23:12:26+00:00"
        }
    },
    "urls": {
        "direct_download": "https://www.loudoun.gov/loudountransitgtfs",
        "latest": "https://storage.googleapis.com/storage/v1/b/mdb-latest/o/us-virginia-loudoun-county-transit-gtfs-1053.zip?alt=media",
        "license": "https://drpt.virginia.gov/data/gtfs-feed-clearinghouse/"
    },
    "redirect": [],
    "is_official": "True"
}