{
    "mdb_source_id": 2712,
    "data_type": "gtfs",
    "provider": "Autobuses Samar",
    "name": "Sourced from the Spanish National Access Point, run by MIMTRANS",
    "location": {
        "country_code": "ES",
        "bounding_box": {
            "minimum_latitude": null,
            "maximum_latitude": null,
            "minimum_longitude": null,
            "maximum_longitude": null,
            "extracted_on": "2025-07-21T23:55:26+00:00"
        }
    },
    "urls": {
        "direct_download": "https://nap.transportes.gob.es/api/Fichero/download/964",
        "authentication_type": 0,
        "latest": "https://storage.googleapis.com/storage/v1/b/mdb-latest/o/es-autobuses-samar-gtfs-2712.zip?alt=media",
        "license": "https://nap.transportes.gob.es/licencia-datos"
    }
}
