{
  "mdb_source_id": 3274,
  "data_type": "gtfs",
  "provider": "SJ Norge",
  "location": {
    "country_code": "SE",
    "bounding_box": {
      "minimum_latitude": null,
      "maximum_latitude": null,
      "minimum_longitude": null,
      "maximum_longitude": null,
      "extracted_on": "2025-12-17 14:34:56.548875+00:00"
    }
  },
  "urls": {
    "direct_download": "https://opendata.samtrafiken.se/gtfs/sjnorge/sjnorge.zip",
    "latest": "https://storage.googleapis.com/storage/v1/b/mdb-latest/o/se-sjnorge-gtfs-3274.zip?alt=media",
    "authentication_type": 1,
    "authentication_info": "https://developer.trafiklab.se/register",
    "api_key_parameter_name": "key",
    "license": "https://www.trafiklab.se/api/gtfs-datasets/gtfs-regional/#licence"
  },
  "name": "GTFS Regional SJ Norge",
  "features": [],
  "status": "active",
  "is_official": "True",
  "redirect": []
}
