{
    "mdb_source_id": 2470,
    "data_type": "gtfs",
    "provider": "BC Transit (Pemberton Valley)",
    "is_official": "True",
    "location": {
        "country_code": "CA",
        "subdivision_name": "British Columbia",
        "municipality": "Pemberton Valley",
        "bounding_box": {
            "minimum_latitude": null,
            "maximum_latitude": null,
            "minimum_longitude": null,
            "maximum_longitude": null,
            "extracted_on": "2025-04-16T22:05:03+00:00"
        }
    },
    "urls": {
        "direct_download": "https://bct.tmix.se/Tmix.Cap.TdExport.WebApi/gtfs/?operatorIds=50",
        "latest": "https://storage.googleapis.com/storage/v1/b/mdb-latest/o/ca-british-columbia-bc-transit-pemberton-valley-gtfs-2470.zip?alt=media",
        "license": "https://www.bctransit.com/open-data/terms-of-use"
    }
}
