{
    "mdb_source_id": 2291,
    "data_type": "gtfs",
    "provider": "Lake County Senior Center Transportation Program",
    "name": "Flex",
    "feed_contact_email": "support+lakecounty-co-us@trilliumtransit.com",
    "location": {
        "country_code": "US",
        "subdivision_name": "Colorado",
        "municipality": "Lake County",
        "bounding_box": {
            "minimum_latitude": 39.207494,
            "maximum_latitude": 39.207494,
            "minimum_longitude": -106.340633,
            "maximum_longitude": -106.340633,
            "extracted_on": "2024-11-27T22:42:08+00:00"
        }
    },
    "urls": {
        "direct_download": "https://data.trilliumtransit.com/gtfs/lakecounty-co-us/lakecounty-co-us--flex-v2.zip",
        "authentication_type": 0,
        "latest": "https://storage.googleapis.com/storage/v1/b/mdb-latest/o/us-colorado-lake-county-senior-center-transportation-program-gtfs-2291.zip?alt=media"
    },
    "redirect": []
}
