{
    "mdb_source_id": 2444,
    "data_type": "gtfs",
    "provider": "STAR Transit",
    "is_official": "True",
    "feed_contact_email": "support+startransit-va-us@trilliumtransit.com", 
    "name": "Flex",
    "location": {
        "country_code": "US",
        "subdivision_name": "Virginia",
        "bounding_box": {
            "minimum_latitude": null,
            "maximum_latitude": null,
            "minimum_longitude": null,
            "maximum_longitude": null,
            "extracted_on": "2025-04-09T17:57:45+00:00"
        }
    },
    "urls": {
        "direct_download": "https://data.trilliumtransit.com/gtfs/startransit-va-us/startransit-va-us--flex-v2.zip",
        "latest": "https://storage.googleapis.com/storage/v1/b/mdb-latest/o/us-virginia-star-transit-flex-gtfs-2444.zip?alt=media"
    }
}
