{
    "mdb_source_id": 3403,
    "data_type": "gtfs",
    "provider": "KentKart Duzce - Third party generated from KentKart",
    "is_official": "False",
    "location": {
        "country_code": "TR",
        "subdivision_name": "Duzce",
        "bounding_box": {
            "minimum_latitude": 55.874955000775294,
            "maximum_latitude": 57.7746047262964,
            "minimum_longitude": 21.0165956136552,
            "maximum_longitude": 28.1167317149993,
            "extracted_on": "2026-07-29T20:03:08+00:00"
        }
    },
    "urls": {
        "direct_download": "https://github.com/Egezenn/kk-gtfs/raw/main/data/duzce.zip",
        "authentication_type": 0,
        "latest": "https://storage.googleapis.com/storage/v1/b/mdb-latest/o/tr-duzce-kentkart-gtfs-3403.zip?alt=media",
        "license": "https://github.com/Egezenn/kk-gtfs/blob/main/DATA_LICENSE"
    },
    "redirect": []
}
