{
    "mdb_source_id": 21,
    "data_type": "gtfs",
    "provider": "Coos County Area Transit (CCAT)",
    "feed_contact_email": "support+test+cooscounty-or-us@trilliumtransit.com",
    "features": [
        "fares-v1"
    ],
    "location": {
        "country_code": "US",
        "subdivision_name": "Oregon",
        "municipality": "Coos Bay",
        "bounding_box": {
            "minimum_latitude": 42.87881944,
            "maximum_latitude": 43.982245,
            "minimum_longitude": -124.434431,
            "maximum_longitude": -123.345208,
            "extracted_on": "2022-03-14T20:06:40+00:00"
        }
    },
    "urls": {
        "direct_download": "https://oregon-gtfs.trilliumtransit.com/gtfs_data/cooscounty-or-us/cooscounty-or-us.zip",
        "authentication_type": 0,
        "latest": "https://storage.googleapis.com/storage/v1/b/mdb-latest/o/us-oregon-coos-county-area-transit-ccat-gtfs-21.zip?alt=media"
    },
    "redirect": []
}
