{
  "mdb_source_id": 2864,
  "data_type": "gtfs",
  "provider": "City of Douglas",
  "location": {
    "country_code": "US",
    "bounding_box": {
      "minimum_latitude": null,
      "maximum_latitude": null,
      "minimum_longitude": null,
      "maximum_longitude": null,
      "extracted_on": "2025-10-30 18:02:52.236271+00:00"
    },
    "subdivision_name": "Arizona",
    "municipality": "Douglas"
  },
  "urls": {
    "direct_download": "https://rapid.nationalrtap.org/GTFSFileManagement/UserUploadFiles/13058/douglas_az_gtfs.zip",
    "latest": "https://storage.googleapis.com/storage/v1/b/mdb-latest/o/us-arizona-douglas-city-of-douglas-gtfs-2864.zip?alt=media",
    "authentication_type": 0
  },
  "feed_contact_email": "noelle.lievanos@douglasaz.gov",
  "features": [],
  "status": "active",
  "is_official": "True",
  "redirect": []
}