{
    "mdb_source_id": 1265,
    "data_type": "gtfs",
    "provider": "Collegamenti marittimi Grandi Navi Veloci",
    "is_official": "True",
    "status": "inactive",
    "location": {
        "country_code": "IT",
        "subdivision_name": "Regione Autonoma della Sardegna",
        "bounding_box": {
            "minimum_latitude": 35.78928874574407,
            "maximum_latitude": 44.411405000188,
            "minimum_longitude": -5.803751351906152,
            "maximum_longitude": 15.0918573,
            "extracted_on": "2022-03-24T00:17:17+00:00"
        }
    },
    "urls": {
        "direct_download": "https://transitfeeds.com/p/collegamenti-marittimi-grandi-navi-veloci/1164/latest/download",
        "latest": "https://storage.googleapis.com/storage/v1/b/mdb-latest/o/it-sardegna-collegamenti-marittimi-grandi-navi-veloci-gtfs-1265.zip?alt=media"
    }
}